{
  "meta": {
    "schema_name": "router_input_v1",
    "protocol_version": "0.1.0",
    "created_at": "2026-04-10T12:00:00Z",
    "generator": "manual_instrument_demo",
    "units": {
      "length": "m",
      "pressure": "kPa",
      "temperature": "degC"
    }
  },
  "plant": {
    "unit_id": "UNIT_01"
  },
  "nodes": [
    {
      "id": "port_tanka_out",
      "type": "EquipmentPort",
      "role": "outlet",
      "label": "TankA Outlet",
      "equipment_ref": "TankA"
    },
    {
      "id": "port_tankb_in",
      "type": "EquipmentPort",
      "role": "inlet",
      "label": "TankB Inlet",
      "equipment_ref": "TankB"
    },
    {
      "id": "reducer_001",
      "type": "InlineReducer",
      "label": "Reducer DN100→DN50",
      "properties": {
        "nominal_diameter_in_mm": 100,
        "nominal_diameter_out_mm": 50
      }
    }
  ],
  "lines": [
    {
      "id": "L_001",
      "from_node": "port_tanka_out",
      "to_node": "reducer_001",
      "service": "Fluid",
      "nominal_diameter_mm": 100,
      "with_flanges": false
    },
    {
      "id": "L_002",
      "from_node": "reducer_001",
      "to_node": "port_tankb_in",
      "service": "Fluid",
      "nominal_diameter_mm": 50,
      "with_flanges": false
    }
  ],
  "constraints": {
    "routing_rules": {
      "min_spacing_between_parallel_lines_m": 0.05,
      "min_clearance_to_floor_m": 0.2,
      "max_elbows_per_line": 12
    }
  }
}